{
  "engine_defaults": {
    "base_seed": 42,
    "generator_id": "toy-v0",
    "n_paths": 1000
  },
  "extensions": {},
  "factor_conditions": {
    "commodities": {
      "drift_annual_pct": 2.0
    },
    "correlation": {
      "equity_bond_regime": "inflation_conditional"
    },
    "credit": {
      "hy_spread_peak_bps": 550.0,
      "hy_spread_start_bps": 350.0,
      "peak_quarter": 12
    },
    "equity": {
      "drift_annual_pct": 7.0,
      "vol_annual_pct": 14.0
    },
    "inflation": {
      "average_pct": 2.0,
      "peak_pct": 4.0,
      "peak_quarter": 6
    },
    "policy_rate": {
      "end_pct": 3.0,
      "start_pct": 3.0
    }
  },
  "horizon": {
    "quarters": 40,
    "start": "2017-Q1"
  },
  "narrative": {
    "dispatches": [
      {
        "date": "2017",
        "headline": "The Inherited Decade \u2014 a quiet start"
      },
      {
        "date": "2021",
        "headline": "The Inherited Decade \u2014 steady as she goes"
      },
      {
        "date": "2025",
        "headline": "The Inherited Decade \u2014 right on schedule"
      }
    ],
    "language": "en",
    "lesson": "This decade is display-only pre-history for cio-04 -- it establishes the calm structure every world inherits, scaled to terminate at that world's own opening book.",
    "summary": "The Inherited Decade: the plan's own past, not a playable world. A deliberately unremarkable decade the toy engine renders before any world begins, so the plan chart has somewhere to come from.",
    "tagline": "Ten quiet years, on purpose.",
    "title": "The Inherited Decade"
  },
  "provenance": {
    "author": "sso:preset",
    "created_at": "2026-08-14T00:00:00Z",
    "source": {
      "kind": "preset"
    }
  },
  "regimes": {
    "mode": "sequence",
    "sequence": [
      {
        "from_quarter": 0,
        "regime": "expansion",
        "to_quarter": 39
      }
    ]
  },
  "spec_version": "1.2.0",
  "status": "draft",
  "structural": {
    "parameter_vintage": "current"
  },
  "world_id": "00000000-0000-4000-9000-000000000525"
}
