{
  "engine_defaults": {
    "base_seed": 1848,
    "generator_id": "toy-v0",
    "n_paths": 1000
  },
  "extensions": {},
  "factor_conditions": {
    "commodities": {
      "drift_annual_pct": -4.0
    },
    "correlation": {
      "equity_bond_regime": "inflation_conditional"
    },
    "credit": {
      "hy_spread_peak_bps": 1800.0,
      "hy_spread_start_bps": 500.0,
      "peak_quarter": 12
    },
    "crisis_windows": [
      {
        "length_quarters": 6,
        "severity": 0.8,
        "start_quarter": 6
      }
    ],
    "equity": {
      "drift_annual_pct": -3.0,
      "vol_annual_pct": 26.0
    },
    "inflation": {
      "average_pct": -1.0,
      "peak_pct": 1.0,
      "peak_quarter": 6
    },
    "policy_rate": {
      "end_pct": 1.0,
      "start_pct": 4.0
    }
  },
  "horizon": {
    "quarters": 40,
    "start": "2027-Q1"
  },
  "narrative": {
    "dispatches": [
      {
        "date": "2027",
        "headline": "Deflation Bust \u2014 year one"
      },
      {
        "date": "2030",
        "headline": "Deflation Bust \u2014 mid-horizon"
      },
      {
        "date": "2034",
        "headline": "Deflation Bust \u2014 late cycle"
      }
    ],
    "language": "en",
    "lesson": "Presets exercise the compile->validate->run->replay rails.",
    "summary": "Deflation Bust: a preset world for the Step-0 loop.",
    "tagline": "Falling prices, a hard credit crunch.",
    "title": "Deflation Bust"
  },
  "provenance": {
    "author": "sso:preset",
    "created_at": "2026-07-24T00:00:00Z",
    "source": {
      "kind": "preset"
    }
  },
  "regimes": {
    "mode": "sequence",
    "sequence": [
      {
        "from_quarter": 0,
        "regime": "deflation_boom",
        "to_quarter": 39
      }
    ]
  },
  "spec_version": "1.0.0",
  "status": "draft",
  "structural": {
    "parameter_vintage": "current"
  },
  "world_id": "00000000-0000-4000-9000-000000000003"
}
