{
  "spec_version": "1.0.0",
  "world_id": "conditional-rate-endpoints-mild-v1",
  "status": "validated",

  "provenance": {
    "created_at": "2026-07-24T00:00:00Z",
    "author": "sso:wp22-task6",
    "source": { "kind": "manual" }
  },

  "narrative": {
    "language": "en",
    "title": "Mild rate-endpoint adherence probe",
    "tagline": "A gentle easing cycle",
    "summary": "A minimal authored world whose only purpose is to probe condition adherence: policy_rate is pinned to a mild start/end pair (a modest easing cycle, the opposite direction to the severe fixture's hike) and nothing else is stressed.",
    "lesson": "Not a scenario for a user -- a WP2.2 Task 6 battery fixture exercising the rate condition type at a mild intensity.",
    "dispatches": [
      { "date": "2027", "headline": "Policy rate begins near 5%", "detail": "A moderately restrictive starting point." },
      { "date": "2030", "headline": "Rates drift down slowly", "detail": "No shock, no crisis window." },
      { "date": "2033", "headline": "Policy rate settles near 2%", "detail": "The mild half of the endpoint pair." }
    ]
  },

  "horizon": { "start": "2027-Q1", "quarters": 40 },

  "regimes": { "mode": "unconditional" },

  "factor_conditions": {
    "policy_rate": { "start_pct": 5.0, "end_pct": 2.0, "path_shape": "linear" }
  },

  "structural": { "parameter_vintage": "historical_average" },

  "engine_defaults": {
    "generator_id": "bootstrap-stratified",
    "n_paths": 1000
  },

  "extensions": { "x_condition_type": "rate", "x_intensity": "mild" }
}
