{
  "spec_version": "1.0.0",
  "world_id": "conditional-crisis-timing-early-v1",
  "status": "validated",

  "provenance": {
    "created_at": "2026-07-24T00:00:00Z",
    "author": "sso:wp22-task6",
    "source": { "kind": "manual" }
  },

  "narrative": {
    "language": "en",
    "title": "Early crisis-timing adherence probe",
    "tagline": "A shock right at the start",
    "summary": "A minimal authored world whose only purpose is to probe condition adherence: a single crisis window is placed early in the horizon and nothing else is stressed.",
    "lesson": "Not a scenario for a user -- a WP2.2 Task 6 battery fixture exercising the crisis_timing condition type placed early.",
    "dispatches": [
      { "date": "2027", "headline": "A shock hits in the first year", "detail": "The crisis window opens at quarter 2." },
      { "date": "2028", "headline": "The window closes after four quarters", "detail": "A moderate, stated severity." },
      { "date": "2033", "headline": "The remaining decade is uneventful", "detail": "Only the placement is being probed here." }
    ]
  },

  "horizon": { "start": "2027-Q1", "quarters": 40 },

  "regimes": { "mode": "unconditional" },

  "factor_conditions": {
    "crisis_windows": [
      { "start_quarter": 2, "length_quarters": 4, "severity": 0.3 }
    ]
  },

  "structural": { "parameter_vintage": "historical_average" },

  "engine_defaults": {
    "generator_id": "bootstrap-stratified",
    "n_paths": 1000
  },

  "extensions": { "x_condition_type": "crisis_timing", "x_intensity": "early" }
}
