{
  "spec_version": "1.0.0",
  "world_id": "conditional-crisis-severity-mild-v1",
  "status": "validated",

  "provenance": {
    "created_at": "2026-07-24T00:00:00Z",
    "author": "sso:wp22-task6",
    "source": { "kind": "manual" }
  },

  "narrative": {
    "language": "en",
    "title": "Mild crisis-severity adherence probe",
    "tagline": "A wobble, not a crash",
    "summary": "A minimal authored world whose only purpose is to probe condition adherence: a single crisis window at low stated severity, fixed timing shared with its severe pair.",
    "lesson": "Not a scenario for a user -- a WP2.2 Task 6 battery fixture exercising the crisis_severity condition type at a mild intensity.",
    "dispatches": [
      { "date": "2027", "headline": "The early years are uneventful", "detail": "Only the severity is being probed here." },
      { "date": "2030", "headline": "A mild wobble arrives", "detail": "Severity 0.2 of the schema's 0-1 scale." },
      { "date": "2033", "headline": "The decade closes without further stress", "detail": "The mild half of the severity pair." }
    ]
  },

  "horizon": { "start": "2027-Q1", "quarters": 40 },

  "regimes": { "mode": "unconditional" },

  "factor_conditions": {
    "crisis_windows": [
      { "start_quarter": 15, "length_quarters": 4, "severity": 0.2 }
    ]
  },

  "structural": { "parameter_vintage": "historical_average" },

  "engine_defaults": {
    "generator_id": "bootstrap-stratified",
    "n_paths": 1000
  },

  "extensions": { "x_condition_type": "crisis_severity", "x_intensity": "mild" }
}
